{
  "catalog_id": "pickup-geometries",
  "catalog_version": "v0.1.0",
  "governed_by": "orbital-thermal-trade-system-model-extension-3a-engineering-spec-v0.4.1 §8, §15.2",
  "authority_note": "Starter bounded entries. nominal_resistance_multiplier is the only output-driving field per §8.4. All values are operator-estimated representative bounds requiring sourcing before operational use.",
  "entries": [
    {
      "pickup_geometry_id": "geom-direct-cold-plate-v0",
      "schema_version": "v0.1.0",
      "label": "Direct Cold Plate",
      "geometry_class": "direct_cold_plate",
      "contact_mode": "direct_bond_or_TIM",
      "nominal_contact_area_fraction": 0.85,
      "nominal_spreading_factor": 1.05,
      "nominal_resistance_multiplier": 1.0,
      "manufacturability_class": "heritage",
      "provenance_class": "operator_estimated",
      "confidence_class": "medium",
      "research_required": false,
      "source_note": "Representative direct cold plate. Multiplier=1.0 means nominal spreader-to-pickup resistance applies directly. Verify TIM resistance and contact area for specific assembly.",
      "notes": "Best geometry for minimizing r_spreader_to_pickup_effective."
    },
    {
      "pickup_geometry_id": "geom-dual-sided-v0",
      "schema_version": "v0.1.0",
      "label": "Dual-Sided Package Pickup",
      "geometry_class": "dual_sided_package_pickup",
      "contact_mode": "top_and_bottom_TIM",
      "nominal_contact_area_fraction": 0.80,
      "nominal_spreading_factor": 1.08,
      "nominal_resistance_multiplier": 0.75,
      "manufacturability_class": "near_term",
      "provenance_class": "operator_estimated",
      "confidence_class": "medium",
      "research_required": true,
      "source_note": "Two-sided package pickup reduces effective resistance per unit area. Multiplier<1.0 reflects parallel heat path. Representative estimate — requires module-specific sourcing.",
      "notes": "Packaging constraint: requires substrate access on both sides."
    },
    {
      "pickup_geometry_id": "geom-microchannel-v0",
      "schema_version": "v0.1.0",
      "label": "Microchannel Plate Interface",
      "geometry_class": "microchannel_plate",
      "contact_mode": "direct_bond",
      "nominal_contact_area_fraction": 0.90,
      "nominal_spreading_factor": 1.02,
      "nominal_resistance_multiplier": 1.15,
      "manufacturability_class": "near_term",
      "provenance_class": "operator_estimated",
      "confidence_class": "medium",
      "research_required": true,
      "source_note": "Microchannel cold plate bonded to package. Higher multiplier than flat plate reflects manifold and bond resistance additions. Representative — fabrication-specific data required.",
      "notes": "High heat flux capable. Pressure drop must be sized into loop."
    },
    {
      "pickup_geometry_id": "geom-vapor-chamber-v0",
      "schema_version": "v0.1.0",
      "label": "Vapor Chamber Interface",
      "geometry_class": "vapor_chamber_interface",
      "contact_mode": "TIM_pad",
      "nominal_contact_area_fraction": 0.92,
      "nominal_spreading_factor": 1.01,
      "nominal_resistance_multiplier": 1.20,
      "manufacturability_class": "heritage",
      "provenance_class": "operator_estimated",
      "confidence_class": "medium",
      "research_required": false,
      "source_note": "Vapor chamber spreader to cold plate or loop interface. Excellent spreading, adds vapor chamber-to-loop coupling resistance. Representative.",
      "notes": "Mass penalty vs. spreading benefit must be traded."
    },
    {
      "pickup_geometry_id": "geom-heat-pipe-v0",
      "schema_version": "v0.1.0",
      "label": "Heat Pipe Interface",
      "geometry_class": "heat_pipe_interface",
      "contact_mode": "saddle_bond",
      "nominal_contact_area_fraction": 0.60,
      "nominal_spreading_factor": 1.10,
      "nominal_resistance_multiplier": 1.40,
      "manufacturability_class": "heritage",
      "provenance_class": "operator_estimated",
      "confidence_class": "medium",
      "research_required": false,
      "source_note": "Embedded heat pipe saddle-bonded to package. Lower contact fraction and higher effective resistance than plate geometries due to line-contact geometry. Representative.",
      "notes": "Orientation-sensitive in 1-g. Space use preferred."
    },
    {
      "pickup_geometry_id": "geom-immersion-v0",
      "schema_version": "v0.1.0",
      "label": "Immersion Bath Pickup",
      "geometry_class": "immersion_bath_pickup",
      "contact_mode": "full_immersion",
      "nominal_contact_area_fraction": 1.0,
      "nominal_spreading_factor": 1.0,
      "nominal_resistance_multiplier": 0.60,
      "manufacturability_class": "developmental",
      "provenance_class": "operator_estimated",
      "confidence_class": "low",
      "research_required": true,
      "source_note": "Full immersion of package in dielectric or compatible fluid. Lowest effective resistance multiplier due to full-surface contact. Compatibility with space environment and long-duration operation research required.",
      "notes": "Fluid management in microgravity is unresolved. Research required before mission application."
    }
  ]
}
